{
  "schema_version": "1.0",
  "lead_id": "L-20261002-2e467793",
  "timestamp": "2026-10-02T22:58:41.825Z",
  "name": "Max Muster",
  "phone": "+49 170 1234567",
  "email": "max@example.de",
  "location": "Heide",
  "project_type": "Wohnung",
  "services": ["Badsanierung", "Fliesenarbeiten"],
  "area": "8",
  "budget": "10.000–25.000 €",
  "preferred_date": "In 1–3 Monaten",
  "message": "Altes Bad aus den 80ern, Wanne soll raus, bodengleiche Dusche gewünscht.",
  "uploaded_files": [{ "field": "file_0", "name": "bad.jpg", "type": "image/jpeg", "size": 284113 }],
  "consent": { "given": true, "text_version": "2026-10-v1", "timestamp": "2026-10-02T22:58:41.825Z" },
  "meta": {
    "source": "website",
    "source_page": "/leistungen/badsanierung",
    "utm": { "utm_source": "google", "utm_medium": "cpc" },
    "user_agent": "Mozilla/5.0 (iPhone; CPU iPhone OS 18_0 like Mac OS X)",
    "locale": "de"
  }
}
